{
  "$schema": "https://json-schema.org/draft/2020-12/schema",
  "$id": "https://docuelevate.org/schemas/docuelevate-setup-v1alpha1.schema.json",
  "title": "DocuElevate declarative setup",
  "type": "object",
  "additionalProperties": false,
  "required": ["apiVersion", "kind", "metadata", "spec"],
  "properties": {
    "apiVersion": {"const": "docuelevate.org/v1alpha1"},
    "kind": {"const": "DocuElevateSetup"},
    "metadata": {
      "type": "object",
      "additionalProperties": false,
      "required": ["name"],
      "properties": {
        "name": {"type": "string", "minLength": 1}
      }
    },
    "spec": {
      "type": "object",
      "additionalProperties": false,
      "properties": {
        "completeSetup": {"type": "boolean", "default": false},
        "settings": {
          "type": "object",
          "additionalProperties": {"$ref": "#/$defs/settingValue"},
          "default": {}
        },
        "users": {
          "type": "array",
          "items": {"$ref": "#/$defs/user"},
          "default": []
        },
        "tribes": {
          "type": "array",
          "items": {"$ref": "#/$defs/tribe"},
          "default": []
        }
      }
    }
  },
  "$defs": {
    "fromEnv": {
      "type": "object",
      "additionalProperties": false,
      "required": ["fromEnv"],
      "properties": {
        "fromEnv": {"type": "string", "pattern": "^[A-Z_][A-Z0-9_]*$"}
      }
    },
    "settingValue": {
      "oneOf": [
        {"type": "string"},
        {"type": "number"},
        {"type": "boolean"},
        {"$ref": "#/$defs/fromEnv"}
      ]
    },
    "user": {
      "type": "object",
      "additionalProperties": false,
      "required": ["email", "username", "password"],
      "properties": {
        "email": {"type": "string", "format": "email"},
        "username": {"type": "string", "pattern": "^[A-Za-z0-9_.-]{2,64}$"},
        "displayName": {"type": "string"},
        "password": {"$ref": "#/$defs/fromEnv"},
        "isAdmin": {"type": "boolean", "default": false}
      }
    },
    "member": {
      "type": "object",
      "additionalProperties": false,
      "required": ["email", "role"],
      "properties": {
        "email": {"type": "string", "format": "email"},
        "role": {"enum": ["admin", "member"]}
      }
    },
    "tribe": {
      "type": "object",
      "additionalProperties": false,
      "required": ["name", "members"],
      "properties": {
        "name": {"type": "string", "minLength": 1},
        "members": {
          "type": "array",
          "minItems": 1,
          "items": {"$ref": "#/$defs/member"}
        }
      }
    }
  }
}
